{
  "instructor": "RahulShetty",
  "url": "rahulshettyacademy.com",
  "services": "projectSupport",
  "expertise": "Automation",
  "courses": {
    "webAutomation": [
      { "courseTitle": "Selenium Webdriver Java", "price": "50" },
      { "courseTitle": "Cypress", "price": "40" },
      { "courseTitle": "Protractor", "price": "40" }
    ],
    "api": [
      { "courseTitle": "Rest Assured Automation using Java", "price": "50" },
      { "courseTitle": "SoapUI Webservices testing", "price": "40" }
    ],
    "mobile": [
      { "courseTitle": "Appium-Mobile Automation using Java", "price": "50" }
    ]
  },
  "linkedIn": "https://www.linkedin.com/in/rahul-shetty-trainer/"
}
